<?xml version="1.0" encoding="ASCII"?>
<!--
  Copyright (c) 2005 The Apache Software Foundation or its licensors, as applicable.

  Licensed under the Apache License, Version 2.0 (the "License");
  you may not use this file except in compliance with the License.
  You may obtain a copy of the License at

     http://www.apache.org/licenses/LICENSE-2.0

  Unless required by applicable law or agreed to in writing, software
  distributed under the License is distributed on an "AS IS" BASIS,
  WITHOUT WARRANTIES OR CONDITIONS OF ANY KIND, either express or implied.
  See the License for the specific language governing permissions and
  limitations under the License.
 -->
<Config xsi:noNamespaceSchemaLocation="http:///org.apache.tuscany.das.rdb/config.xsd" xmlns:xsi="http://www.w3.org/2001/XMLSchema-instance">
		
	<Command name="get all companies" SQL="select * from COMPANY" kind = "Select"/>
	
	<Command name="get named employee" SQL="select * from EMPLOYEE where NAME=:NAME" kind = "Select">
  		<Parameter name=":NAME"/>
  	</Command>
  	
	<Command name="get named employee with company" 
		SQL="select * from EMPLOYEE left outer join COMPANY on EMPLOYEE.ID = COMPANY.EOTMID where EMPLOYEE.NAME=:NAME" kind = "Select">
  		<Parameter name=":NAME"/>
  	</Command>

	  	<Command name="get employee by ID" SQL="select * from EMPLOYEE where ID=:PARAM1" kind = "Select">
  		<Parameter name=":PARAM1"/>
  	</Command>
  	
  	<Command name="get all employees" SQL="select * from EMPLOYEE" kind = "Select"/>
  	
    <Command name="get companies with employee of the month" 
		SQL="select * from COMPANY left outer join EMPLOYEE on COMPANY.EOTMID = EMPLOYEE.ID" kind="Select"/>

<!--	  
  	<Command name="get company and employee of the month" 
  		SQL="select C.*, E.* from COMPANY AS C, EMPLOYEE AS E
  		where C.EOTMID = E.ID" kind = "Select">
  		
  	</Command>
	-->
  	
    <ConnectionProperties driverClassName="org.apache.derby.jdbc.EmbeddedDriver"
        driverURL="jdbc:derby:dastest"/>

	<Table name="COMPANY">
    	<Column name="ID" primaryKey="true" generated="true"/>
  	</Table>
  
  	<Table name="DEPARTMENT">
   		<Column name="ID" primaryKey="true" generated="true"/>
  	</Table>
  		
  	<Table name="EMPLOYEE">
  	  	<Column name="ID" primaryKey="true" generated="true"/>
  	</Table>	
	  	
	<Relationship name="company->employee" primaryKeyTable="EMPLOYEE" foreignKeyTable="COMPANY" many="false" >
      	<KeyPair primaryKeyColumn="ID" foreignKeyColumn="EOTMID" />
  	</Relationship>
			
</Config>
			
