<?xml version="1.0" encoding="ASCII"?>
<Config xsi:noNamespaceSchemaLocation="../../main/resources/config.xsd" xmlns:xsi="http://www.w3.org/2001/XMLSchema-instance">
  
  <Table name="COMPANY" propertyName="CompanyType">
    <Column name="ID" primaryKey="true"/>
  </Table>
  
  <Table name="DEPARTMENT" propertyName="DepartmentType">
    <Column name="ID" primaryKey="true"/>
  </Table>
  <Table name="EMPLOYEE" propertyName="EmployeeType">
  	  <Column name="ID" primaryKey="true"/>
  </Table>
  
  <Relationship name="departments" primaryKeyTable="COMPANY" foreignKeyTable="DEPARTMENT" many="true">
     <KeyPair primaryKeyColumn="ID" foreignKeyColumn="COMPANYID"/>
  </Relationship>	

  <Relationship name="employees" primaryKeyTable="DEPARTMENT" foreignKeyTable="EMPLOYEE" many="true">
     <KeyPair primaryKeyColumn="ID" foreignKeyColumn="DEPARTMENTID"/>
  </Relationship>	
	
</Config>
