<?xml version="1.0" encoding="ASCII"?>
<!--
  Copyright (c) 2005 The Apache Software Foundation or its licensors, as applicable.

  Licensed under the Apache License, Version 2.0 (the "License");
  you may not use this file except in compliance with the License.
  You may obtain a copy of the License at

     http://www.apache.org/licenses/LICENSE-2.0

  Unless required by applicable law or agreed to in writing, software
  distributed under the License is distributed on an "AS IS" BASIS,
  WITHOUT WARRANTIES OR CONDITIONS OF ANY KIND, either express or implied.
  See the License for the specific language governing permissions and
  limitations under the License.
 -->
<Config xsi:noNamespaceSchemaLocation="http:///org.apache.tuscany.das.rdb/config.xsd" xmlns:xsi="http://www.w3.org/2001/XMLSchema-instance">
  	
  <Command name="readEngineParts" kind="Select" SQL="SELECT P1.*, P2.*, P3.* FROM PART AS P1 
  				LEFT JOIN PART AS P2 ON P1.ID = P2.PARENT_ID 
  					LEFT JOIN PART AS P3 on P2.ID = P3.PARENT_ID WHERE P1.ID = 1">
  					<ResultDescriptor columnName="ID" columnType="commonj.sdo.IntObject" tableName="PART"/>
  					<ResultDescriptor columnName="NAME" columnType="commonj.sdo.String" tableName="PART"/>
  					<ResultDescriptor columnName="QUANTITY" columnType="commonj.sdo.IntObject" tableName="PART"/>
  					<ResultDescriptor columnName="PARENT_ID" columnType="commonj.sdo.IntObject" tableName="PART"/>
  					
  					<ResultDescriptor columnName="ID" columnType="commonj.sdo.IntObject" tableName="PART"/>
  					<ResultDescriptor columnName="NAME" columnType="commonj.sdo.String" tableName="PART"/>
  					<ResultDescriptor columnName="QUANTITY" columnType="commonj.sdo.IntObject" tableName="PART"/>
  					<ResultDescriptor columnName="PARENT_ID" columnType="commonj.sdo.IntObject" tableName="PART"/>
  					
  					<ResultDescriptor columnName="ID" columnType="commonj.sdo.IntObject" tableName="PART"/>
  					<ResultDescriptor columnName="NAME" columnType="commonj.sdo.String" tableName="PART"/>
  					<ResultDescriptor columnName="QUANTITY" columnType="commonj.sdo.IntObject" tableName="PART"/>
  					<ResultDescriptor columnName="PARENT_ID" columnType="commonj.sdo.IntObject" tableName="PART"/>
  					
  </Command>
  
  <Table tableName="PART">
  	<Column columnName="ID" primaryKey="true"/>
  </Table>
  
  <Relationship name="subparts" primaryKeyTable="PART" foreignKeyTable="PART" many="true">
     <KeyPair primaryKeyColumn="ID" foreignKeyColumn="PARENT_ID"/>
  </Relationship>	
	
</Config>
