<?xml version="1.0" encoding="ASCII"?>
<!--
  Copyright (c) 2005 The Apache Software Foundation or its licensors, as applicable.

  Licensed under the Apache License, Version 2.0 (the "License");
  you may not use this file except in compliance with the License.
  You may obtain a copy of the License at

     http://www.apache.org/licenses/LICENSE-2.0

  Unless required by applicable law or agreed to in writing, software
  distributed under the License is distributed on an "AS IS" BASIS,
  WITHOUT WARRANTIES OR CONDITIONS OF ANY KIND, either express or implied.
  See the License for the specific language governing permissions and
  limitations under the License.
 -->
<Config xsi:noNamespaceSchemaLocation="http:///org.apache.tuscany.das.rdb/config.xsd" xmlns:xsi="http://www.w3.org/2001/XMLSchema-instance">
     
    <Command name="get all books" SQL="SELECT * FROM BOOK" kind="Select"/>
    
    <Command name="get Cat in the Hat" SQL="SELECT * FROM BOOK WHERE NAME = 'Cat in the Hat'" kind="Select"/>
    
    <Command name="get book by ID" SQL="SELECT * FROM BOOK WHERE BOOK.BOOK_ID = ?" kind="Select"/>
    
    
    
    <Table tableName="BOOK" typeName="Book">
        <Column columnName="BOOK_ID" primaryKey="true"/>
        <Column columnName="AUTHOR" propertyName="Writer"/>
	    <Column columnName="OCC" collision="true"/>
    </Table>
    
</Config>
