<?xml version="1.0" encoding="UTF-8"?>
<Config xsi:noNamespaceSchemaLocation="../../main/resources/config.xsd" xmlns:xsi="http://www.w3.org/2001/XMLSchema-instance">
    
    <Command name="all customers" SQL="select * from CUSTOMER" kind="Select"/>
    
    <Command name="customer and orders"
        SQL="select * from CUSTOMER left join ANORDER on CUSTOMER.ID = ANORDER.CUSTOMER_ID where CUSTOMER.ID = :ID"
        kind="Select">
        <Parameter name=":ID"/>
    </Command>
    
    <Command name="customer and orders"
        SQL="select * from CUSTOMER left join ANORDER on CUSTOMER.ID = ANORDER.CUSTOMER_ID where CUSTOMER.ID = :ID"
        kind="Select">
        <Parameter name=":ID"/>
    </Command>
    
    <!-- Test usage of '?' rather than named parameter -->
    <Command name="order by id with ?" SQL="select * from ANORDER where ANORDER.ID = ?"
        kind="Select">
        <Parameter name=":ID"/>
    </Command>
    
    <Command name="update customer"
        SQL="update CUSTOMER set LASTNAME = 'Pavick' where ID = :ID"
        kind="Update">
        <Parameter name=":ID"/>
    </Command>
    
    <ConnectionProperties driverClassName="org.apache.derby.jdbc.EmbeddedDriver"
        driverURL="jdbc:derby:dastest"/>
    
    <Table name="CUSTOMER">
        <Column name="ID" primaryKey="true"/>
    </Table>
    
    <Table name="ANORDER">
        <Column name="ID" primaryKey="true"/>
    </Table>
    
    <Relationship name="orders" primaryKeyTable="CUSTOMER"
        foreignKeyTable="ANORDER" many="true">
        <KeyPair primaryKeyColumn="ID" foreignKeyColumn="CUSTOMER_ID"/>
    </Relationship>
    
</Config>